,emoji_symbol,emoji_name,emoji_code,emoji_description
0,😀,Grinning Face,U+1F600,"A yellow face with simple, open eyes and a broad, open smile, showing upper teeth and tongue on some platforms. Often conveys general pleasure and good cheer or humor.Not to be confused with😃 Grinning Face With Big Eyesor😄 Grinning Face With Smiling Eyes, which have the same smiles but more expressive eye shapes.This emoji has a cat variant,😺 Grinning Cat Face."
1,😃,Grinning Face with Big Eyes,U+1F603,"A yellow face with smiling eyes and a broad, open smile, showing upper teeth and tongue on some platforms. Often conveys general happiness and good-natured amusement.Similar to😀 Grinning Facebutwith taller, more excited eyes."
2,😄,Grinning Face with Smiling Eyes,U+1F604,"A yellow face with smiling eyes and a broad, open smile, showing upper teeth and tongue on some platforms. Often conveys general happiness and good-natured amusement.Similar to😀 Grinning Faceand😃Grinning Face With Big Eyes, but with warmer, less excited eyes.This emoji has a cat variant,😸Grinning Cat Face With Smiling Eyes."
3,😁,Beaming Face with Smiling Eyes,U+1F601,"A yellow face with smiling eyes and full-toothed grin, as if sayingCheese!for the camera.Teeth may be smoothed-over or crosshatched. Often expresses a radiant, gratified happiness. Tone varies, including warm, silly, amused, or proud.Prior to 2017, Apple's design resembled its😬 Grimacing Face.Beaming Face with Smiling Eyeswas approved as part ofUnicode 6.0in 2010
under the name “Grinning Face with Smiling Eyes”
and added toEmoji 1.0in 2015."
4,😆,Grinning Squinting Face,U+1F606,"A yellow face with a broad, open smile and scrunched, X-shapedeyes. Often conveysexcitement or hearty laughter.Similar to😀 Grinning Facebut with eyes that might saySquee!orAwesome!An emoji form of the >< or xD emoticons."
5,😅,Grinning Face with Sweat,U+1F605,"Has the same grin and eyes as😄 Grinning Face With Smiling Eyesbut with a single, blue bead of sweat, usually over its left eye. Intended to depict nerves or discomfort but commonly used to express a close call, as if sayingWhew!and wiping sweat from the forehead."
6,🤣,Rolling on the Floor Laughing,U+1F923,"A yellow face with a big grin and scrunched, X-shaped eyes, tilted on its side as if rolling on the floor laughing (the internet acronymROFL). Shedstwo tears and tilts right on most platforms. Often conveys hysterical laughtermore intense than😂 Face With Tears of Joy.Microsoft's designpreviously featureda smiley with hands and feet."
7,😂,Face with Tears of Joy,U+1F602,"A yellow face with a biggrin, uplifted eyebrows, and smiling eyes, each shedding a tear from laughing so hard. Widely used to show something is funny or pleasing.Not to be confused with😭 Loudly Crying Faceor🤣Rolling on the Floor Laughing, which expresses more intense laughter.One of the ten most popular emojis between 2014–2018 and was named the Oxford Dictionaries 2015Word of the Year.This emoji has a cat variant,😹Cat Face With Tears of Joy."
8,🙂,Slightly Smiling Face,U+1F642,"A yellow face with simple, open eyes and a thin, closed smile. Conveys a wide range of positive, happy, and friendly sentiments. Its tone canalso be patronizing, passive-aggressive, or ironic, as if sayingThis is finewhen it’s really not."
9,🙃,Upside-Down Face,U+1F643,"A classic smiley, turned upside down. Implemented as a flipped version of🙂 Slightly Smiling Faceon most platforms.Commonly used to conveyirony, sarcasm, joking, or a sense of goofiness or silliness.Its intent can besimilar to the bemusedOh well!of🤷Person Shruggingor theshruggieemoticon, ¯\_(ツ)_/¯.Microsoft's designpreviously featureda full-toothed grin."
10,😉,Winking Face,U+1F609,"A yellow face with a slightsmile shown winking, usually its left eye. May signala joke, flirtation, hidden meaning, or general positivity. Tone varies, including playful, affectionate, suggestive, or ironic.Not to be confused with the more mischievous orsexual😏 Smirking Face.An emoji form of the ;) emoticon."
11,😊,Smiling Face with Smiling Eyes,U+1F60A,"A yellow face with smiling eyes and a broad, closed smile turning up to rosy cheeks. Often expresses genuine happiness and warm, positive feelings.An emoji form of the ^^ emoticon.OnSnapchat, this emoji next to a contact denotes that you message thatperson often but they aren't your#1 Best Friend."
12,😇,Smiling Face with Halo,U+1F607,"A yellow face with smiling eyes, closed smile, andhalo, usually blue, overhead. Often represents angels,prayers, and blessings. May also conveyangelicbehavior, e.g., doing good deeds. See also👼Baby Angel.Several platforms, including Apple, featureanexpression similar to their😊Smiling Face With Smiling Eyes."
13,🥰,Smiling Face with Hearts,U+1F970,"A yellow face with smiling eyes, a closed smile, rosy cheeks, and several hearts floating around its head. Expresses a range of happy, affectionate feelings, especially being in love. The number of hearts (three or more) varies by platform.Apple's design features the same expression as its☺️ Smiling Face."
14,😍,Smiling Face with Heart-Eyes,U+1F60D,"A yellow face with an open smile, sometimes showing teeth, and red, cartoon-styled hearts for eyes. Often conveys enthusiastic feelings of love, infatuation, and adoration, e.g.,I love/am in love with this person or thing.This emoji has a cat variant,😻 Smiling Cat Face With Heart-Eyes."
15,🤩,Star-Struck,U+1F929,"A yellow face with a broad, open smile, showing upper teeth on most platforms, with stars for eyes, as if seeing a beloved celebrity. Color of stars widely varies by platform, though commonly gold or red. May express that someone or something is amazing, fascinating, impressive, or exciting."
16,😘,Face Blowing a Kiss,U+1F618,"A yellow face winking with puckered lips blowing a kiss, depictedas a small,red heart. May representa kiss goodbye or good night and convey feelings of love and affection more generally.Many platforms feature the same eyes as on their😉Winking Face.Microsoft’s designpreviously featureda feminine smiley with long eyelashes and redlipstick, which could leave akiss mark."
17,😗,Kissing Face,U+1F617,"A yellow face with simple, open eyes and puckered lips giving a kiss. Commonly conveys sentiments of love and affection.Like😙 Kissing Face With Smiling Eyes, this emoji is sometimes taken to represent whistling, especially when paired with amusical note. May convey such feelings as surprise, admiration, contempt, or feigned innocence, as a person casually whistling after wrongdoing saying,Nothing to look at here.Similar to😙 Kissing Face With Smiling Eyesand😚Kissing Face With Closed Eyesbut with less intimate eyes."
18,☺️,️ Smiling Face,"U+263A, U+FE0F","A classic smiley.A yellow face with a modest smile, rosy cheeks, and soft, closed eyes. Many platforms, including Apple, feature relaxed eyebrows. Conveys a wide range of warm, positive feelings, including love, happiness, and gratitude.Similar to😊Smiling Face With Smiling Eyes,which has a broader smile, no eyebrows, and smiling eyes.This smiley predates Unicode emoji support. In its Unicode name ofWhite Smiling Face,whitedoesnotrefer to skin tone or ethnicity.See the glossary for thetermwhitein Unicode character names."
19,😚,Kissing Face with Closed Eyes,U+1F61A,"A yellow face with smiling eyes, rosy cheeks, and puckered lips giving a kiss. Commonly conveys sentiments of romantic love and affection. Several platforms, including Apple, feature the same eyes and cheeks as their☺️Smiling Face.With its closed eyes, features an expression more intimate than😙Kissing Face With Smiling Eyes’s and😗Kissing Face’s.This emoji has a cat variant,😽Kissing Cat Face."
20,😙,Kissing Face with Smiling Eyes,U+1F619,"A yellow face with smiling eyes and puckered lips giving a kiss. Commonly conveys sentiments of love and affection.Like😗Kissing Face, this emoji is sometimes taken to represent whistling, especially when paired with amusical note. May convey such feelings as surprise, admiration, contempt, or feigned innocence, as a person with hands in pocket casually whistling after wrongdoing, as ifsayingNothing to look at here.With its smiling eyes, features an expression fonder than😗Kissing Face'sbut less intimate than😚Kissing Face With Closed Eyes's."
21,😋,Face Savoring Food,U+1F60B,"A yellow face with smiling eyes and a broad, closed smile with itstongue sticking out of one corner, as if licking its lips in appetite or contentment. Widely used to convey that a food item is delicious. May also express that a person is attractive."
22,😛,Face with Tongue,U+1F61B,"A yellow face with small, open eyes and a big grin, playfully sticking out itstongue. Can variously convey a sense of fun, excitement, silliness, cuteness, happiness, or jesting, as if sayingJust kidding!Generally less goofy than😜Winking Face With Tongueand less animated than😝Squinting Face With Tongue.Googlepreviously featureda more defeated expression andSamsung, a more mocking one.Because of its stuck-out tongue, note that this smiley may be applied or interpreted in suggestive ways."
23,😜,Winking Face with Tongue,U+1F61C,"A yellow face sticking out itstongueand making a zany wink, usually shown with its right eye closed and left wide open. Often conveys a sense of fun, excitement, wackiness, buffoonery, or joking.Generally goofier than😛Face With Tongueand😝Squinting Face With Tonguebut less ""crazy"" than🤪Zany Face."
24,🤪,Zany Face,U+1F92A,"A smiley making a silly face. A yellow face with a big grin and wide, white eyes, one larger than the other and in a wild, cockeyed expression. Many platforms, including Apple, depict its tongue stuck out and head tilted; others feature a full-toothed grin, giving it a more unhinged appearance.Commonly represents such activities as acting goofy, having fun, and partying as well as various senses of slang terms likecrazy,usually in a positive manner. May convey a spiritof wackiness more generally."
25,😝,Squinting Face with Tongue,U+1F61D,"A yellow face with scrunched, X-shaped eyes and a big grin, sticking out itstongue. Often conveys a sense of fun, excitement, playfulness, hilarity, and happiness, as if sayingSquee!orAwesome!Similar to😆Grinning Squinting Face.Generally more exuberant than😛Face With Tongueand😜Winking Face With Tongue. Samsungpreviously featureda more sour expression.Because of its stuck-out tongue, note that this smiley may be applied or interpreted in suggestive ways."
26,🤑,Money-Mouth Face,U+1F911,"A yellow face with raised eyebrows,dollar signsfor eyes, and an open smile sticking out a tongue styled after a green,dollar banknote. Some platforms depict the dollar-sign eyes in green circles.Used for a wide range of content dealing with money, including: making money, loving wealth, being or feeling rich, and concepts of success and excellence (e.g.,on themoney)."
27,🤗,Hugging Face,U+1F917,"A yellow face smiling withopen hands, as if giving a hug.May be used to offer thanks and support, show love and care, or express warm, positive feelings more generally.Due to its hand gesture, often used to represent jazz hands, indicating such feelings as excitement, enthusiasm, or a sense of flourish or accomplishment.Joins🤔Thinking Face,🤫Shushing Face, and🤭Face With Hand Over Mouthas one of the few smileys featuring hands. For a more obvious hug, see🫂 People Hugging(new in 2020).Hugging Facewas approved as part ofUnicode 8.0in 2015
and added toEmoji 1.0in 2015."
28,🤭,Face with Hand Over Mouth,U+1F92D,"A yellow face with a hand covering its mouth. Appleand Facebookfeature simple, open eyes, suggesting someone gaspingOh my!in serious surprise, shock, concern, or apology. Other platforms depict a face with smiling eyes and/or blushing cheeks, suggesting coy laughter or embarrassment, as if cheekily sayingOops!May be used to similar effect as🙊 Speak-No-Evil Monkey.See also🤐Zipper-Mouth Face.Joins🤗Hugging Face,🤔Thinking Face, and🤫Shushing Faceas one of the few smileys featuring hands.Facebook's designpreviously featuredsmiling eyes and mouth.Face with Hand Over Mouthwas approved as part ofUnicode 10.0in 2017
under the name “Smiling Face with Smiling Eyes and Hand Covering Mouth”
and added toEmoji 5.0in 2017."
29,🤫,Shushing Face,U+1F92B,"A yellow face placing an index finger over pursed lips, as if issuingShh!orShush!for silence.Some platforms feature raised eyebrows. Apple’s design suggests the face is tilting back slightly.May convey silence, quiet, secrecy, and discreetness. May also create a sense of buzz and anticipation, e.g., an exclusive sneak peek or news scoop.See also🤐Zipper-Mouth Face. Joins🤗Hugging Face,🤔Thinking Face, and🤭Face With Hand Over Mouthas one of the few smileys featuring hands."
30,🤔,Thinking Face,U+1F914,"A yellow face with furrowed eyebrows looking upwards with thumb and index finger resting on its chin. Intended to show a person pondering or deep in thought.Often used to question or scorn something or someone,as if sayingHmm, I don't know about that. Tone varies, including earnest, playful, puzzled, skeptical, and mocking.May be paired with💭 Thought Balloonor💡 Light Bulbto representthinking, (having) ideas, and learning.Joins🤗Hugging Face,🤫Shushing Face, and🤭Face With Hand Over Mouthas one of the few smileys featuring a hand."
31,🤐,Zipper-Mouth Face,U+1F910,"A yellow face with simple, open eyes and a closed zipper for a mouth. Meaning widely varies, but commonly conveys a secret or that someone willkeepone (e.g.,My lips are sealed). May also be used to tell someone to stop talking (e.g., Zip it!orI’ll shut up now).Google's design for😯 Hushed Facepreviously featureda zipper-mouth."
32,🤨,Face with Raised Eyebrow,U+1F928,"A yellow face with a flat, neutral mouth and furrowed eyebrows, its left raised higher than its right. Conveys a wide variety of sentiments, including suspicion, skepticism, concern, consideration, disbelief, and disapproval.Its expressionhas notably been likenedto the signature look of comedianStephen Colbertas well as actor/wrestlerDwayne “The Rock” Johnson."
33,😐,Neutral Face,U+1F610,"A yellow face with simple, open eyes and a flat, closed mouth. Intended to depict a neutral sentiment but often used to convey mild irritation and concern or a deadpan sense of humor."
34,😑,Expressionless Face,U+1F611,"A yellow face with flat, closed eyes and mouth. May convey a sense of frustration or annoyance more intense than suggested by😐 Neutral Face,as if taking a moment to collect itself."
35,😶,Face Without Mouth,U+1F636,"A yellow face with simple, open eyes and no mouth, as if at a loss for words. Meaning widely varies, but commonly conveys speechlessness, humility, and silence.May also convey moderately negative emotions, such as disappointment, frustration, or sadness.Samsung’s designpreviously featuredraised eyebrows and blushing cheeks."
36,😏,Smirking Face,U+1F60F,"A yellow face with a sly, smug, mischievous, or suggestive facial expression. It features a half-smile, raised eyebrows, and eyes looking to the side. Often used to convey flirtation or sexual innuendo.Not to be confused with😒 Unamused Face, which has similar eyes but a pouting mouth.This emoji has a cat variant,😼 Cat Face With Wry Smile.OnSnapchat, this emoji next to a contact denotesthat this person snaps you frequentlybut you do not often snap them in return.Smirking Facewas approved as part ofUnicode 6.0in 2010
and added toEmoji 1.0in 2015."
37,😒,Unamused Face,U+1F612,"A yellow face with slightly raised eyebrows, a frown, and eyes looking to the side. May convey a variety of negative emotions, including irritation, displeasure, grumpiness, and skepticism, as if giving theside-eye.Not to be confused with😏Smirking Face, which features similar eyes but a wry smile."
38,🙄,Face with Rolling Eyes,U+1F644,"A yellow face witha small, closed mouth, flat or frowning, rolling its large, white eyes upwards. As with the gesture of an eye-roll, commonly conveys moderate disdain, disapproval, frustration, or boredom. Tone varies, including playful, sassy, resentful, and sarcastic, as if sayingYeah, whatever.Samsung's designpreviously depicteda face smiling and looking to the side.Face with Rolling Eyeswas approved as part ofUnicode 8.0in 2015
and added toEmoji 1.0in 2015."
39,😬,Grimacing Face,U+1F62C,"A yellow face with simple open eyes showing clenched teeth. May represent a range of negative or tense emotions, especially nervousness, embarrassment, or awkwardness (e.g.,Eek!).Resembled😁 Beaming Face With Smiling Eyeson Apple iOSprior to 2017. Apple’s design for🥶 Cold Facefeatures the same mouth. Samsung's designpreviously featuredmore puckered-looking lips.OnSnapchat, thisemoji next to a contact denotes that you send the most snaps to the same person that they do., i.e.,you share a#1 Best Friend.Grimacing Facewas approved as part ofUnicode 6.1in 2012
and added toEmoji 1.0in 2015."
40,🤥,Lying Face,U+1F925,"A yellow face with raised eyebrows, enlarged eyes, slight frown, and long nose,indicatingit’s telling a lie in the manner ofPinocchio. Like that character, Facebook's design features a wooden nose.May represent lying, a liar, and other concepts of deceit and dishonesty to varying degrees of intensity. Sometimes used to convey disbelief (e.g.,You must be kidding) or feeling abashed (e.g., as ifcaught in the act of lying)."
41,😌,Relieved Face,U+1F60C,"A yellow face with soft, closed eyes, raised eyebrows, and a slight smile. Facebook’s design features a slightly open mouth, as ifsighing.Conveys various pleasant feelings, includingcontentment, calm, peace, andrelief. May also convey feelings of happiness or good-natured humor more generally.GoogleandMicrosoftpreviously included sweat beads. Not to be confused with😔Pensive Face, which has similarly shaped eyes but in a sadder expression."
42,😔,Pensive Face,U+1F614,"A pensive, remorseful face. Saddened by life. Quietly considering where things all went wrong.Depicted as a yellow face with sad, closed eyes, furrowed eyebrows, and a slight, flat mouth.May convey a variety of sad emotions, including feeling disappointed, hurt, or lonely. Less intense than other sad emojis like😭Loudly Crying Faceand more introspective.Microsoft's designpreviously featureda more neutral, bored expression. Samsung’s designpreviously lookedmore guilty or worried.Not to be confused with😌Relieved Face, which has similarly shaped eyes but in a happier expression."
43,😪,Sleepy Face,U+1F62A,"A yellow face with closed eyes, mouth slightly open, and a blue snot bubble coming from its nose.Snot bubblesindicate a character is tired or sleeping in anime or manga.Not to be confused with😴 Sleeping FaceWhile sometimes used to convey sadness, dissastification, or illness, Sleepy Face is also not to be confused with😢 Crying Face,😥 Sad but Relieved Face, or other emojis with tear or sweat droplets.Samsung’s designpreviously featuredtwo, cartoon-styled,sleeping-symbolZz’soverhead."
44,🤤,Drooling Face,U+1F924,"A yellow face, usually shown with closed eyes and raised eyebrows, with saliva drooling from one corner of its mouth. Often used to show desire for a person (sexy,attractive) or object (e.g., delicious food). May also represent someone is tired or sleeping.Not to be confused with😋 Face Savoring Foodor😪 Sleepy Face.Samsung's designpreviously featureda startled facial expression."
45,😴,Sleeping Face,U+1F634,"A yellow face with eyes closed and mouth letting out three, cartoon-styledZzz’s overhead to indicate it's sound asleep. The Zzz’s appearblue or purple across most platforms. May also represent boredom (slang,snooze).Generally used instead of😪 Sleepy Faceto convey sleepor sleepiness."
46,😷,Face with Medical Mask,U+1F637,"A yellow face with closed eyes wearing a white surgical mask, as used byhealth workersinhospitals. Alsowornto avoidsicknessor spreading airborne diseases.Windows 8.1 depicted a ridgeddust mask, as used byconstruction workers, changed to a medical mask in Windows 10.In 2020, this emoji becameprimarily usedin reference toCoronavirus / COVID-19."
47,🤒,Face with Thermometer,U+1F912,"A yellow face with raised or furrowed eyebrows and athermometerin its mouth. Often depicted with red cheeks, as if feverish. May be used to represent ahospitalpatient or person with a cold or flu.Differs from other smileys conveying illness, such as🤢 Nauseated Face(appearing as if it'sgoing to vomit) or🤕 Face With Head-Bandage(physical injury)."
48,🤕,Face with Head-Bandage,U+1F915,"A yellow face with a half-frown and white bandage wrapped around its head, often depicted partially over one eye. May represent physical injury or pain but also emotional hurting, sometimes for ironic effect.Differs from other smileys conveying illness, such as🤢 Nauseated Face(appearing as if it’s going to vomit) or🤒 Face With Thermometer(used especially for colds and flus)."
49,🤢,Nauseated Face,U+1F922,"A sickly-green face with concerned eyes and puffed, often red cheeks, as if holding back vomit. May represent physical illness or general disgust. Not to be confused with🤮 Face Vomiting.Differs from other smileys conveying sickness, including🤒 Face With Thermometer(used especially for colds and flus) and🤕 Face With Head-Bandage(physical injury)."
50,🤮,Face Vomiting,U+1F92E,"A yellow face with scrunched, X-shaped eyes spewing bright-green vomit. May represent physical illness or disgust, more intensely so than🤢 Nauseated Face."
51,🤧,Sneezing Face,U+1F927,"A yellow face with scrunched, X-shaped eyes sneezing or blowing its nose into a white tissue, as if from a cold or allergies. Often depicted with a crumpled-looking mouth.May also represent someone in an emotional state wiping away tears, as at awedding."
52,🥵,Hot Face,U+1F975,"A reddish-orange face with furrowed eyebrows, tongue stuck out, and beads of sweat, as if overheated from high temperatures. Number and position of sweat droplets vary by platforms. May also represent physical attractiveness (slang,hot).Most platforms feature expressions that are variations on😰 Anxious Face With Sweator😥 Sad but Relieved Face."
53,🥶,Cold Face,U+1F976,"An icy-blue face with gritted teeth usually depicted with icicles clinging to its cheeks or jaw, as if frozen from extreme cold. May also represent unfriendliness (slang,cold) or excellence (slang,coolorchill).Apple’s design features the same expression as its😬 Grimacing Face."
54,🥴,Woozy Face,U+1F974,"A yellow face with a crumpled mouth and a cockeyed expression, as iftired and emotionalfrom inebriation or smitten with love. Depicted with raised or furrowed eyebrows and at least one eye half-open. WhatsApp's design features a tongue hanging out.Meaning widely varies, but commonly conveys intoxication orinfatuation. Its dazed expression may also represent such feelings or states as bewilderment,irritation, disgust, exhaustion, wackiness, or complete satisfaction."
55,😵,Dizzy Face,U+1F635,"A yellow face with X’s orspiralsfor eyes and a round, open mouth. Often depicted with raised or furrowed eyebrows. Facebook’s design features a purple forehead.May convey a heightened or hyperbolic sense of such feelings asshock, surprise, disbelief, awe, andamazement, as if staggered to the point of disorientation (i.e.,dizzy). May also representsickness,nausea,intoxication, anddeath, e.g., slangI’m dead!Not to be confused with😲Astonished Face, which previously featured X-shaped eyes on several platforms, though their meanings may overlap.Dizzy Facewas approved as part ofUnicode 6.0in 2010
and added toEmoji 1.0in 2015."
56,🤯,Exploding Head,U+1F92F,"A yellow face with an openmouth, the top of its head exploding in the shape of a brain-like mushroom cloud. A visual form of the expressionmind blown, itmay represent such emotions as shock, awe, amazement, and disbelief.Apple’s design features the same expression as its😦 Frowning Face With Open Mouth."
57,🤠,Cowboy Hat Face,U+1F920,"Yee-haw! A yellow smiley wearing a wide-brimmed, brown-leather cowboy hat. Its smile varies across platforms.May convey a sense of exuberance, whimsy, confidence, adventure, or other sentiments.Several vendors, including Apple, featurethe same expression as their😃 Grinning Face With Big Eyes."
58,🥳,Partying Face,U+1F973,A yellow face with a party hat blowing a party horn as confetti floats around its head. Used for celebrating joyous occasions (such asNew Year's EveorWorld Emoji Day) and enjoying good times more generally.Apple’s design features the same expression as its😚Kissing Face With Closed Eyes.
59,😎,Smiling Face with Sunglasses,U+1F60E,"A yellow face with a broad, closed smile wearing blacksunglasses, as if a pair of classicWayfarers. Often used to convey the slangsense ofcool. May also express a confident, carefree attitude or that something is excellent.🤓Nerd Facewears similarly shapedeyeglasses.OnSnapchat, this emoji next to a contact denotes that you have best friends in common with this person."
