,emoji_symbol,emoji_name,emoji_code,emoji_description
762,🏄‍♀️,‍♀️ Woman Surfing,"U+1F3C4, U+200D, U+2640, U+FE0F","The female version of the🏄Surferemoji.The Woman Surfing emoji is aZWJ sequencecombining🏄Person Surfing,‍Zero Width Joinerand♀Female Sign.
These display as a single emoji on supported platforms."
763,🚣,Person Rowing Boat,U+1F6A3,"A small rowboat suitable fora small number of people.Couplesorfamiliessometimes hire these as an activity on calm waters.Person Rowing Boatwas approved as part ofUnicode 6.0in 2010
under the name “Rowboat”
and added toEmoji 1.0in 2015."
764,🚣‍♂️,‍♂️ Man Rowing Boat,"U+1F6A3, U+200D, U+2642, U+FE0F","The male version of the🚣Rowboatemoji. Currently identical in appearance to the non-gendered base emoji.The Man Rowing Boat emoji is aZWJ sequencecombining🚣Person Rowing Boat,‍Zero Width Joinerand♂Male Sign.
These display as a single emoji on supported platforms."
765,🚣‍♀️,‍♀️ Woman Rowing Boat,"U+1F6A3, U+200D, U+2640, U+FE0F","The female version of the🚣Rowboatemoji.The Woman Rowing Boat emoji is aZWJ sequencecombining🚣Person Rowing Boat,‍Zero Width Joinerand♀Female Sign.
These display as a single emoji on supported platforms."
766,🏊,Person Swimming,U+1F3CA,"A person swimming in a pool, theocean, or another body of water.Lacked goggleson prior versions of iOS.Swims facing to the left of screen on all major platforms.Person Swimmingwas approved as part ofUnicode 6.0in 2010
under the name “Swimmer”
and added toEmoji 1.0in 2015."
767,🏊‍♂️,‍♂️ Man Swimming,"U+1F3CA, U+200D, U+2642, U+FE0F","The male version of the🏊Swimmeremoji. Currently identical in appearance to the non-gendered base emoji.The Man Swimming emoji is aZWJ sequencecombining🏊Person Swimming,‍Zero Width Joinerand♂Male Sign.
These display as a single emoji on supported platforms."
768,🏊‍♀️,‍♀️ Woman Swimming,"U+1F3CA, U+200D, U+2640, U+FE0F","The female version of the🏊Swimmeremoji.The Woman Swimming emoji is aZWJ sequencecombining🏊Person Swimming,‍Zero Width Joinerand♀Female Sign.
These display as a single emoji on supported platforms."
769,⛹️,️ Person Bouncing Ball,"U+26F9, U+FE0F","A person with a ball, which is generally displayed as a basketballer running and dribbling (bouncing) thebasketball.Person Bouncing Ballwas approved as part ofUnicode 5.2in 2009
under the name “Person with Ball”
and added toEmoji 1.0in 2015."
770,⛹️‍♂️,️‍♂️ Man Bouncing Ball,"U+26F9, U+FE0F, U+200D, U+2642, U+FE0F","The male version of the⛹Person With Ballemoji.Currently identical in appearance to the non-gendered base emoji.The Man Bouncing Ball emoji is aZWJ sequencecombining⛹Person Bouncing Ball,‍Zero Width Joinerand♂Male Sign.
These display as a single emoji on supported platforms."
771,⛹️‍♀️,️‍♀️ Woman Bouncing Ball,"U+26F9, U+FE0F, U+200D, U+2640, U+FE0F","The female version of the⛹Person With Ballemoji.The Woman Bouncing Ball emoji is aZWJ sequencecombining⛹Person Bouncing Ball,‍Zero Width Joinerand♀Female Sign.
These display as a single emoji on supported platforms."
772,🏋️,️ Person Lifting Weights,"U+1F3CB, U+FE0F","A person liftinga barbell loaded with weights above their head.Person Lifting Weightswas approved as part ofUnicode 7.0in 2014
under the name “Weight Lifter”
and added toEmoji 1.0in 2015."
773,🏋️‍♂️,️‍♂️ Man Lifting Weights,"U+1F3CB, U+FE0F, U+200D, U+2642, U+FE0F","The male version of the🏋Weight Lifteremoji.Currently identical in appearance to the non-gendered base emoji.The Man Lifting Weights emoji is aZWJ sequencecombining🏋Person Lifting Weights,‍Zero Width Joinerand♂Male Sign.
These display as a single emoji on supported platforms."
774,🏋️‍♀️,️‍♀️ Woman Lifting Weights,"U+1F3CB, U+FE0F, U+200D, U+2640, U+FE0F","The female version of the🏋Weight Lifteremoji.The Woman Lifting Weights emoji is aZWJ sequencecombining🏋Person Lifting Weights,‍Zero Width Joinerand♀Female Sign.
These display as a single emoji on supported platforms."
775,🚴,Person Biking,U+1F6B4,"A person riding abicyclefor leisure, sport or transport. Intended to be gender-neutral.Person Bikingwas approved as part ofUnicode 6.0in 2010
under the name “Bicyclist”
and added toEmoji 1.0in 2015."
776,🚴‍♂️,‍♂️ Man Biking,"U+1F6B4, U+200D, U+2642, U+FE0F","The male version of the🚴Bicyclistemoji. Currently identical in appearance to the non-gendered base emoji.The Man Biking emoji is aZWJ sequencecombining🚴Person Biking,‍Zero Width Joinerand♂Male Sign.
These display as a single emoji on supported platforms."
777,🚴‍♀️,‍♀️ Woman Biking,"U+1F6B4, U+200D, U+2640, U+FE0F","The female version of the🚴Bicyclistemoji.The Woman Biking emoji is aZWJ sequencecombining🚴Person Biking,‍Zero Width Joinerand♀Female Sign.
These display as a single emoji on supported platforms."
778,🚵,Person Mountain Biking,U+1F6B5,"A person (cyclist) who rides a mountain bike: a type of off-roadbicycle.Intended to be gender-neutral.Person Mountain Bikingwas approved as part ofUnicode 6.0in 2010
under the name “Mountain Bicyclist”
and added toEmoji 1.0in 2015."
779,🚵‍♂️,‍♂️ Man Mountain Biking,"U+1F6B5, U+200D, U+2642, U+FE0F","The male version of the🚵Mountain Bicyclistemoji. Currently identical in appearance to the non-gendered base emoji.The Man Mountain Biking emoji is aZWJ sequencecombining🚵Person Mountain Biking,‍Zero Width Joinerand♂Male Sign.
These display as a single emoji on supported platforms."
780,🚵‍♀️,‍♀️ Woman Mountain Biking,"U+1F6B5, U+200D, U+2640, U+FE0F","The female version of the🚵Mountain Bicyclistemoji.The Woman Mountain Biking emoji is aZWJ sequencecombining🚵Person Mountain Biking,‍Zero Width Joinerand♀Female Sign.
These display as a single emoji on supported platforms."
781,🤸,Person Cartwheeling,U+1F938,"A person doing a cartwheel, representing the sport of gymnastics.Person Cartwheelingwas approved as part ofUnicode 9.0in 2016
under the name “Person Doing Cartwheel”
and added toEmoji 3.0in 2016."
782,🤸‍♂️,‍♂️ Man Cartwheeling,"U+1F938, U+200D, U+2642, U+FE0F","The Man Cartwheeling emoji is aZWJ sequencecombining🤸Person Cartwheeling,‍Zero Width Joinerand♂Male Sign.
These display as a single emoji on supported platforms."
783,🤸‍♀️,‍♀️ Woman Cartwheeling,"U+1F938, U+200D, U+2640, U+FE0F","The Woman Cartwheeling emoji is aZWJ sequencecombining🤸Person Cartwheeling,‍Zero Width Joinerand♀Female Sign.
These display as a single emoji on supported platforms."
784,🤼,People Wrestling,U+1F93C,"Two people in the sport of wrestling.People Wrestlingwas approved as part ofUnicode 9.0in 2016
under the name “Wrestlers”
and added toEmoji 3.0in 2016."
785,🤼‍♂️,‍♂️ Men Wrestling,"U+1F93C, U+200D, U+2642, U+FE0F","The Men Wrestling emoji is aZWJ sequencecombining🤼People Wrestling,‍Zero Width Joinerand♂Male Sign.
These display as a single emoji on supported platforms."
786,🤼‍♀️,‍♀️ Women Wrestling,"U+1F93C, U+200D, U+2640, U+FE0F","The Women Wrestling emoji is aZWJ sequencecombining🤼People Wrestling,‍Zero Width Joinerand♀Female Sign.
These display as a single emoji on supported platforms."
787,🤽,Person Playing Water Polo,U+1F93D,"A person shown in water with a ball,playing the sport of water polo.Person Playing Water Polowas approved as part ofUnicode 9.0in 2016
under the name “Water Polo”
and added toEmoji 3.0in 2016."
788,🤽‍♂️,‍♂️ Man Playing Water Polo,"U+1F93D, U+200D, U+2642, U+FE0F","The Man Playing Water Polo emoji is aZWJ sequencecombining🤽Person Playing Water Polo,‍Zero Width Joinerand♂Male Sign.
These display as a single emoji on supported platforms."
789,🤽‍♀️,‍♀️ Woman Playing Water Polo,"U+1F93D, U+200D, U+2640, U+FE0F","The Woman Playing Water Polo emoji is aZWJ sequencecombining🤽Person Playing Water Polo,‍Zero Width Joinerand♀Female Sign.
These display as a single emoji on supported platforms."
790,🤾,Person Playing Handball,U+1F93E,"Person Playing Handballwas approved as part ofUnicode 9.0in 2016
under the name “Handball”
and added toEmoji 3.0in 2016."
791,🤾‍♂️,‍♂️ Man Playing Handball,"U+1F93E, U+200D, U+2642, U+FE0F","The Man Playing Handball emoji is aZWJ sequencecombining🤾Person Playing Handball,‍Zero Width Joinerand♂Male Sign.
These display as a single emoji on supported platforms."
792,🤾‍♀️,‍♀️ Woman Playing Handball,"U+1F93E, U+200D, U+2640, U+FE0F","The Woman Playing Handball emoji is aZWJ sequencecombining🤾Person Playing Handball,‍Zero Width Joinerand♀Female Sign.
These display as a single emoji on supported platforms."
793,🤹,Person Juggling,U+1F939,"A person juggling between three and five colored balls. The person shown in this emoji generally has the appearance of a man, and wears a hat on most major platforms.Person Jugglingwas approved as part ofUnicode 9.0in 2016
under the name “Juggling”
and added toEmoji 3.0in 2016."
794,🤹‍♂️,‍♂️ Man Juggling,"U+1F939, U+200D, U+2642, U+FE0F","The Man Juggling emoji is aZWJ sequencecombining🤹Person Juggling,‍Zero Width Joinerand♂Male Sign.
These display as a single emoji on supported platforms."
795,🤹‍♀️,‍♀️ Woman Juggling,"U+1F939, U+200D, U+2640, U+FE0F","The Woman Juggling emoji is aZWJ sequencecombining🤹Person Juggling,‍Zero Width Joinerand♀Female Sign.
These display as a single emoji on supported platforms."
796,🧘,Person in Lotus Position,U+1F9D8,"Person in Lotus Positionwas approved as part ofUnicode 10.0in 2017
and added toEmoji 5.0in 2017."
797,🧘‍♂️,‍♂️ Man in Lotus Position,"U+1F9D8, U+200D, U+2642, U+FE0F","The Man in Lotus Position emoji is aZWJ sequencecombining🧘Person in Lotus Position,‍Zero Width Joinerand♂Male Sign.
These display as a single emoji on supported platforms."
798,🧘‍♀️,‍♀️ Woman in Lotus Position,"U+1F9D8, U+200D, U+2640, U+FE0F","The Woman in Lotus Position emoji is aZWJ sequencecombining🧘Person in Lotus Position,‍Zero Width Joinerand♀Female Sign.
These display as a single emoji on supported platforms."
799,🎪,Circus Tent,U+1F3AA,"A circular ‘big top’ circus tent, with atriangle flagon top."
800,🛹,Skateboard,U+1F6F9,"A skateboard emoji, shown on some platforms from the topand others showing the under-side of the board.Emojipedia's sample image wasmodelled after Tony Hawk's skateboard."
801,🛶,Canoe,U+1F6F6,Canoe
802,🎗️,️ Reminder Ribbon,"U+1F397, U+FE0F","Anawareness ribbon, worn toshow support of a cause or group."
803,🎟️,️ Admission Tickets,"U+1F39F, U+FE0F","A ticket or tickets to an event that may say ""Admit One"" on the front. Shown in pink or yellow on most platforms."
804,🎫,Ticket,U+1F3AB,"A paper ticket, which may be for a theatre show, sporting event, or other ticketed performance. Shown in blue, yellow or grey on most platforms."
805,🎖️,️ Military Medal,"U+1F396, U+FE0F",Aribbon and medallion generallyawardedto aperson in the military for heroic acts.
806,🏆,Trophy,U+1F3C6,"A trophy given as an recognition of achievement, usually in sports. The trophy emoji is a gold cup, with a engraving on the bottom detailing the award.InSnapchat, the trophy provides access to the Trophy Case forunlocking emoji achievements."
807,🏅,Sports Medal,U+1F3C5,"A gold medal, given to a person who has won a sporting event, such as a race. Not to be confused with themilitary medal emoji."
808,🥇,1st Place Medal,U+1F947,1st Place Medal
809,🥈,2nd Place Medal,U+1F948,2nd Place Medal
810,🥉,3rd Place Medal,U+1F949,3rd Place Medal
811,⚽,Soccer Ball,U+26BD,"A round, black and white ball used in the game ofsoccer, which is known asfootballin much of the world. See also:emojis for the World Cup."
812,⚾,Baseball,U+26BE,"A white baseball, with regulation red stitching. Used in the game of the same name,baseball."
813,🥎,Softball,U+1F94E,"A softball, which is differentiated from a baseball by size (it is larger, though hard to tell in emoji form) and color (yellow, not white)."
814,🏀,Basketball,U+1F3C0,"An orange-colored basketball displayed with a hoop.Many versions of this emoji omitthe hoop,and display only the basketball.This emoji can be sent on Facebook Messenger to unlock ahiddenbasketball game."
815,🏐,Volleyball,U+1F3D0,"A volleyball emoji, showing the round ball used in the sport. Played as part of theSummer Olympic Games."
816,🏈,American Football,U+1F3C8,"The oval ball used in the game ofAmerican football, known as gridiron in some countries."
817,🏉,Rugby Football,U+1F3C9,"The oval-shaped ball used in the game ofrugby. Varies slightly in shapein the two main versions of the game:rugby unionandrugby league.The appearance of this emoji varies, with a brown leather appearancein Apple and Google’s imagery,but a more popularwhite-with-highlight color in Twitter’sdesign."
818,🎾,Tennis,U+1F3BE,"A tennis racket (racquet) with a tennis ball. Only a ball is shown on Apple, LG, Twitter, Facebook, and Mozilla platforms."
819,🥏,Flying Disc,U+1F94F,"A flying disc, more commonly known as a frisbee. Used in the sport ofUltimateordisc golf."
820,🎳,Bowling,U+1F3B3,"Ten-pin bowling emoji, showing a bowling ball and pins."
821,🏏,Cricket Game,U+1F3CF,"A cricket bat, with a cricket ball also shown. May be displayed with a wicket present."
822,🏑,Field Hockey,U+1F3D1,"A hockey stick and ball, used in the sport of field hockey. Not to be confused with theice hockey stick and puck."
823,🏒,Ice Hockey,U+1F3D2,"A hockey stick and puck, used in the sport of ice hockey. Not to be confused with thefield hockey stick and ball."
824,🥍,Lacrosse,U+1F94D,Lacrosse
825,🏓,Ping Pong,U+1F3D3,A paddle and ping pong ball used in the sport of table tennis.
826,🏸,Badminton,U+1F3F8,Badminton
827,🥊,Boxing Glove,U+1F94A,"A padded boxing glove, used in the sport ofboxing. Usually red."
828,🥋,Martial Arts Uniform,U+1F94B,A white uniform used in marital arts such as judo or karate. Held together using a material belt.Known askeikogiin Japanese.
829,🥅,Goal Net,U+1F945,Goal Net
830,⛳,Flag in Hole,U+26F3,"A red, triangularflag shown sittingin theholeof a golf course green. Some versions of this emoji also include golf balls.Androidpreviously displayed this emojias the head of aputter (golf club) hitting a golf ball.Not to be confused with theTriangular Flag on Post emoji."
831,⛸️,️ Ice Skate,"U+26F8, U+FE0F","A single ice skate used for ice skating. Shown in white andfacingrighton most platforms.In the sport of figure skating, a white ice skate is traditionally worn by women, and a black ice skate worn by men. This emoji doesn't define the color to be used, but no major vendor currently displays this as black."
832,🎣,Fishing Pole,U+1F3A3,A fishingrod (pole) with a fish caught on the end.
833,🎽,Running Shirt,U+1F3BD,A singlet or running shirt. Shown with a sash.
834,🎿,Skis,U+1F3BF,"A pair of skis which are shown on some platforms alongside ski poles and/or ski boots. The color and design of the skis varies by platform, with some versions also showing the skis moving at speed.Distinct from theskier emojiwhich features a person skiing."
835,🛷,Sled,U+1F6F7,"A sled, otherwise known as a toboggan or sledge."
836,🥌,Curling Stone,U+1F94C,Curling Stone
837,🎯,Direct Hit,U+1F3AF,Adart board with dart hitting the center / bullseye region.
838,🎱,Pool 8 Ball,U+1F3B1,"The game of billiards,of whichpoolis a common version. This emoji displays the black8 ballon most platforms, which looks similar to theMagic 8-Balltoy.Samsung displays this emoji with a cue and triangular arrangement ofcolored balls."
839,🎮,Video Game,U+1F3AE,"A video game emoji,shown on major platforms as a consolegamepad withD-pad,joysticks, and buttons."
840,🎰,Slot Machine,U+1F3B0,Agamblingmachine generally found in casinos. Shows three wheels with a lever to the side. Most platforms display three 7 digits on this emoji.
841,🎲,Game Die,U+1F3B2,"A six-sided die, used in a range of board and turn-based games. Commonly calleddicewhich refers to the plural ofdie.Most other platforms display this emoji as a single game die in white or red.LGshows two game dice in this emoji."
842,🧩,Puzzle Piece,U+1F9E9,Puzzle Piece
843,♟️,️ Chess Pawn,"U+265F, U+FE0F",️ Chess Pawn
844,🎭,Performing Arts,U+1F3AD,"Two masks often used on maps to indicate a theatre, these originate inGreek Theatreas masks oftragedy and comedy.One maskfrowns, the other smiles."
845,🎨,Artist Palette,U+1F3A8,"Apaletteused by an artist when painting, to store and mix paint colors."
846,🧵,Thread,U+1F9F5,"A spool of thread, as used for sewing. Thread color varies across platforms, though often depicted in red or blue and on a wooden spool. Sometimes shown with an end unraveling.Commonly used for various content concerning sewing, knitting, arts and crafts, clothing and fashion, and metaphoricalthreads(e.g., a discussion thread online).WhatsApp’s design includes a needle."
847,🧶,Yarn,U+1F9F6,"A ball of yarn, as used to knit ascarf. Color varies across platforms, but often depicted in green, blue, or magenta and shown with an end unraveling. Sometimes depicted with a pair of knitting needles stuck in the ball.Commonly used for various content concerning knitting and needlework (e.g.,sewing,crocheting), clothing and fashion, arts and crafts, cold weather, and cats."
848,🎼,Musical Score,U+1F3BC,A staff (or stave) showing atreble clefand five horizontal lines.
849,🎤,Microphone,U+1F3A4,"A microphone, usedto amplify a person’s voice when speaking or singing. Shown with music notes on most platforms, implying it to be used for a singer / singing."
850,🎧,Headphone,U+1F3A7,"Headphones, used to listen to music or other forms audio, such as podcasts.Most platforms display this emoji with large over-ear headphones in shades of black, blue, and gray.Apple previously displayedthis emoji asiconic iPod/iPhone white earbuds."
851,🎷,Saxophone,U+1F3B7,Saxophone
852,🎸,Guitar,U+1F3B8,"A guitar, which is mostly shown as an electric guitar and usually ingenerally red.Discontinued emoji sets or such asLG andHTC displayed this as an acoustic guitar, as didpreviousversionofWindowsand Twemoji."
853,🎹,Musical Keyboard,U+1F3B9,"A small section of a music keyboard, which differs from acomputer keyboard.Showing white and black keys, this keyboard is played by a pianist to makemusic. Commonly used as a piano emoji."
854,🎺,Trumpet,U+1F3BA,"A trumpet, a brass instrument played in jazz bands."
855,🎻,Violin,U+1F3BB,A violin emoji. Sometimesusedin the context oftheworld’s smallest violin.
856,🥁,Drum,U+1F941,A drum shown with drumsticks. A percussion instrument which is likely to be displayed as a snare drum.
857,🎬,Clapper Board,U+1F3AC,"A board which contains the scene name, number, and film. A person ‘claps’ the board shut at the top while saying “Action” or “Cut” to indicate the start and stop of a scene that is being filmed.This is used to synchronise the audio of the clap with the visuals."
858,🏹,Bow and Arrow,U+1F3F9,A bow and arrow used in the sport of archery. May also be used bycupid.
859,🚣,Person Rowing Boat,U+1F6A3,"A small rowboat suitable fora small number of people.Couplesorfamiliessometimes hire these as an activity on calm waters.Person Rowing Boatwas approved as part ofUnicode 6.0in 2010
under the name “Rowboat”
and added toEmoji 1.0in 2015."
860,🗾,Map of Japan,U+1F5FE,"Shows a map of the country of Japan, which is the only country to have its own emoji map. Other countries can be found on thevarious globe emojis, or theworld map emoji."
861,🏔️,️ Snow-Capped Mountain,"U+1F3D4, U+FE0F",A mountain with snow resting at higher altitudes. Similar in appearance to theMount Fujiemoji.
862,⛰️,️ Mountain,"U+26F0, U+FE0F",A mountain shown with two peaks and blue sky. Similar to thesnow capped mountain emoji.
863,🌋,Volcano,U+1F30B,"A volcano, erupting with smoke and lava."
864,🗻,Mount Fuji,U+1F5FB,Mount Fuji (calledFuji-san in Japan) is the largest mountain in Japan. Often seen with snow on the peak in colder months of the year.It is considered lucky in Japan to dream of Mt Fuji in thefirst dream of the new year.
865,🏕️,️ Camping,"U+1F3D5, U+FE0F","A campsite featuring atentand atree, and perhaps a campfire. Similar to thetentemoji."
866,🏖️,️ Beach with Umbrella,"U+1F3D6, U+FE0F","A beach showing sand, and an umbrella for protection from thesun."
867,🏜️,️ Desert,"U+1F3DC, U+FE0F",️ Desert
868,🏝️,️ Desert Island,"U+1F3DD, U+FE0F",️ Desert Island
869,🏞️,️ National Park,"U+1F3DE, U+FE0F","A national park, generally displayed withmountains, a river or stream, andtrees."
870,🏟️,️ Stadium,"U+1F3DF, U+FE0F","A large capacity stadium, featuring a large amount of seating forsporting fans, or people attending other shows hosted by the stadium."
871,🏛️,️ Classical Building,"U+1F3DB, U+FE0F",️ Classical Building
872,🏗️,️ Building Construction,"U+1F3D7, U+FE0F",A construction site generally depicted as a tower crane shown lifting steel or other building materials.
873,🏘️,️ Houses,"U+1F3D8, U+FE0F",Multiple houses.
874,🏚️,️ Derelict House,"U+1F3DA, U+FE0F","Ahousewhich isunoccupied, and has become derelict. In a state of disrepair."
875,🏠,House,U+1F3E0,"A house, otherwise known as a home when someone is living in it. Suitable for a couple or larger family, other perhaps housemates.Distinct from an apartment building due to its detached form, this house is likely in the suburbs of a city or arural area."
876,🏡,House with Garden,U+1F3E1,"A suburban-looking house, witha tree, flower, or shrubs around it in the garden."
877,🏢,Office Building,U+1F3E2,"A generic, high-rise office building. Generally found in cities, and most active during business hours.The office building shown in Twemoji 2.0 is ofTwitter HQin San Fransisco."
878,🏣,Japanese Post Office,U+1F3E3,"A Japanesepost office, featuring theテ Japanese postal markon the front of the building (or showing this markinsteadof the building in Microsoft’s artwork)."
879,🏤,Post Office,U+1F3E4,"A European-style post office. Apostal horncan be seen on the front, which is commonly found in the logos ofEuropean Postal Services."
880,🏥,Hospital,U+1F3E5,"A place where people are taken to receive medical care. This hospital has a large red cross on the front, often used as a symbol for health care."
881,🏦,Bank,U+1F3E6,"A retail bank branch, where people can performmoney-related tasks. Also a common location to find anATM.This emoji came to also mean ""slacking off"" orevading responsibilityin Japan, due to the BK lettersbeing associated with the slang termbakkureru."
882,🏨,Hotel,U+1F3E8,"A hotel building,displayed on most platforms as a building with many windows and a letter H on the front.Can be easily confused with theLove Hotel, orHospitalemoji.Microsoft this emoji as abed, when viewed usingWindows."
883,🏩,Love Hotel,U+1F3E9,Alove hotelis a hotel that can be hiredby the hourinstead of asaccommodationfor the evening.Sometimes mistaken for aget well soonemojidue to the similarity in appearance to thehospital. The Microsoft version of thisemoji previouslydisplayinga bed with a heart above it.
884,🏪,Convenience Store,U+1F3EA,"A shop that is generally open for longer hours than a regular supermarket, sometimes 24 hours per day.Sells a range of goods from snacks, meals, hygiene products and household items."
885,🏫,School,U+1F3EB,"A school building with multiple storeys, and a clock on the front. A place that children, or teenagers attend for their education.Displays on Windows asa collection of school-related items: anapple,ruler, andpencil."
886,🏬,Department Store,U+1F3EC,"A large department store, selling a range of products to the general public. Shown as a large building with a billboard on most platforms, or as ashopping bagon Windows."
887,🏭,Factory,U+1F3ED,"An industrial factory, withflue-gas stacksreleasing exhaust into the air."
888,🏯,Japanese Castle,U+1F3EF,"A traditional Japanese Castle, usually made from stone and wood."
889,🏰,Castle,U+1F3F0,"A castle, in a stylethat can be found inFranceand other parts ofEurope."
890,💒,Wedding,U+1F492,"An emoji to depict a wedding, displayed by most vendors as a Christianchurchandlove hearts. Some platforms displayacrossorbellon the building."
891,🗼,Tokyo Tower,U+1F5FC,"TheTokyo Toweris the second-tallest building in Japan, located inMinato, Tokyo.Built in 1957, the design of the Tokyo Tower was inspired by the Eiffel Tower in Paris,Franceandmay be confused for it due to the small size of the emoji."
892,🗽,Statue of Liberty,U+1F5FD,"TheStatue of Liberty, often used as a depictionofNew York City."
893,⛪,Church,U+26EA,"A church building, generally associated with Christian denominations. In addition quietprayer, churches hold regularworshipservices,weddings,baptismsand funerals."
894,🕌,Mosque,U+1F54C,"A mosque building, a place of worship for followes ofIslam. Shown with a domed roof and aminaret."
895,🛕,Hindu Temple,U+1F6D5,"Hindu Templewas approved as part ofUnicode 12.0in 2019
and added toEmoji 12.0in 2019."
896,🕍,Synagogue,U+1F54D,A synague; a place of worship for followers of Judaism. Displayed with aStar of Davidon the front.
