,emoji_symbol,emoji_name,emoji_code,emoji_description
1167,⛓️,️ Chains,"U+26D3, U+FE0F","Two parallel lengths of silver chain. Occasionally used as an icon before ahyperlinkor for metaphorical connections or chains, e.g., slangoff the chains.Samsung’s designpreviously featuredstylized, white chains in a blue square, as a sign or icon forsnow chainsfor winter driving.Not to be confused with🔗 Link,📎 Paperclip,🖇️ Linked Paperclips, or🧷 Safety Pin."
1168,🧰,Toolbox,U+1F9F0,"A red box for holding and transporting tools, such as ahammerandwrench. Generally depicted as latched shut with silver hardware and a black handle.Commonly used for literal or metaphorical tools, toolkits, and building.Google’s design is shown open with two wrenches and a pair of pliers; WhatsApp includes a hammer in front."
1169,🧲,Magnet,U+1F9F2,"A horseshoe magnet, as used to pick upiron.Depicted at various angles in red with silver-tipped poles.Commonly used for various content concerning literal and figurative magnetism and attraction. May also be used in various science-related contexts more generally.Twitter’s design features twoelectric boltscoming from its poles. WhatsApp’s horseshoe is half blue, denoting an opposite magnetic pole."
1170,⚗️,️ Alembic,"U+2697, U+FE0F","An apparatus for distilling, as used in medievalalchemy. Generally depicted as a round flask with a neck angled down to the right. Positioned on a short stand and containing a mysterious green, purple, or blue liquid.Commonly used for various content concerning chemistry and science more generally. May represent various liquids, such as potions ormedicines, as well as metaphorical laboratories and experiments.Thanks to the alembic’s association with alchemy, this emoji may also convey a sense of magic. And, thanks to its resemblance to a glass pipe, some use the emojito representa bong or other drug paraphernalia.Samsung’s designpreviously featureda copper still, as used for makingwhiskey."
1171,🧪,Test Tube,U+1F9EA,"A test tube, as used to conduct chemical experiments in a laboratory. Depicted as a clear cylinder, open at one end and containing a green liquid. Positioned at a 45° angle.May be used for various content concerning chemistry and science more generally. May also represent other liquids, such as potions or medicines, as well metaphorical laboratories and experiments.Some platforms include volume markings or display the liquid as bubbling.WhatsApp’s design features a blue liquid."
1172,🧫,Petri Dish,U+1F9EB,"A petri dish, as used to culturemicrobes. Depicted as a clear, shallow cylinder with a red, blue, or green growth medium, such asagar, with splotches of variously colored cells, like bacteria.May be used for various content concerning biology and science more generally. May also be used to represent germs and other microorganisms.Google’s design features a dropper, Samsung’s a lid."
1173,🧬,DNA,U+1F9EC,"The double helix ofDNA, the genetic blueprint for life. Color and orientation vary across platforms, but positioned at a 45° angle and in multiple, bright colors to represent the molecule’s spiraling, ladder-like structure.May be used for various content concerning biology, genetics, and science more generally. May also be used for various content concerning literal or figurative life and evolution."
1174,🔬,Microscope,U+1F52C,"Amicroscope, as used in science laboratories to magnify small objects, such ascellsorinsects. Depicted as a compound opitical microscope with an adjustable eyepiece, lens, arm, and slidestage mounted on a base. Generally shown as metal with the viewing apparatus facing left.Commonly used for various content concerning science and research. May also be used for various senses of inspection (e.g., taking a closer took).Google’s design is shown in red."
1175,🔭,Telescope,U+1F52D,"A telescope, as used to gaze atstarsandplanetsin the night sky. Shown with an optical tube mounted on a tripod, positioned at various angles and generally depicted as metal.Commonly used for various content concerning astronomy, outer space, celestial objects, and science more generally. May also be used for various concepts of sight (e.g., spying, viewing).Google and Twitter’s designs feature red hardware."
1176,📡,Satellite Antenna,U+1F4E1,"A dish antenna, as used to send or receive information to or from a communicationsatellite—or👽 Extraterrestrial Life. Generally depicted as a mounted, metal dish with its antenna positioned at 45° to the upper right.Commonly used to represent satellitetelevision,radio, and internet, as well as broadcasting, streaming, cellular, and wireless services or technologies. May also represent various concepts of signals and transmission.Several platforms, including Samsung and Twitter, feature curved, radiating lines, as if transmitting data. Google’s design is depicted in blue."
1177,💉,Syringe,U+1F489,"A medical syringe, as used to administer a shot or drawblood. Generally depicted at a 45° angle with a needle to the upper right, emitting two droplets of the red fluid in its barrel, as blood drawn for testing or donation at ahospital.Commonly used for content concerning health, medicine, and related professions as well as various senses of needles, drugs, and blood.GoogleandFacebook’sdesigns previously featured green liquids,Samsung’ssyringe was empty."
1178,🩸,Drop of Blood,U+1FA78,"A drop of blood shown in red. May be used to signify a blood donation, bleeding, injury ormenstruation.Drop of Bloodwas approved as part ofUnicode 12.0in 2019
and added toEmoji 12.0in 2019."
1179,💊,Pill,U+1F48A,"A capsule of medicine. Generally depicted at a 45° angle, half red, half yellow. Commonly used for content concerning health, medicine, and related professions as well various types of drugs.Samsung’s designpreviously featureda blue-and-white capsule with two round pills, one orange, the other white.GoogleandMicrosoft’sdesigns previously featured blue in their capsules."
1180,🩹,Adhesive Bandage,U+1FA79,"Adhesive Bandagewas approved as part ofUnicode 12.0in 2019
and added toEmoji 12.0in 2019."
1181,🩺,Stethoscope,U+1FA7A,"Stethoscopewas approved as part ofUnicode 12.0in 2019
and added toEmoji 12.0in 2019."
1182,🚪,Door,U+1F6AA,"A door, as to the entrance of a room,house, or new opportunity. (We’ll see ourselves out 🚪🚶.)Depicted in brown, as made of wood, with a gold handle.May represent literal doors and related concepts (e.g., rooms, houses) but often used figuratively (e.g., opening or closing metaphorical doors).Google’s design features a peephole and Microsoft’s a step, as if a front door."
1183,🛏️,️ Bed,"U+1F6CF, U+FE0F","A bed, made up for sleeping in ahouse,hotel, or othersleeping accommodation. Shown with a headboard at the left, footboard, mattress, pillow, and sheet. Most platforms suggest a wooden frame and feature blue or red sheets.Commonly used for various content concerning beds, furniture, and housing as well assleeping, relaxing, and other bedroom activities.Vendors implement the same style of bed for🛌Person in Bed, but without a sleeper under the covers."
1184,🛋️,️ Couch and Lamp,"U+1F6CB, U+FE0F","A couch (sofa) with a floor lamp on the right, as in theliving room of ahouse. Color and style of the couch and lamp vary widely by platform.Used for various content concerning furniture and housing as well as resting and lounging."
1185,🪑,Chair,U+1FA91,"A chair for sitting at a table, or in a standalone location. Materials may vary, with wood a common choice.Distinct from theseat emoji, whichis generally fixed, as opposed to a chairwhich can be moved.Chairwas approved as part ofUnicode 12.0in 2019
and added toEmoji 12.0in 2019."
1186,🚽,Toilet,U+1F6BD,"A white toilet, as used to deposit a💩Pile of Poo.(Don’t forget the🧻Roll of Paper.)Most platforms depict a porcelain toilet in profile, bowl facing to the left.Commonly used for various content concerning going to the bathroom or bathrooms more generally. May also be used figuratively, e.g.,down the toilet.Google, Microsoft, and Twitter’s designs left the seat up."
1187,🚿,Shower,U+1F6BF,"A silver shower head, streaming water to the left. Pressure level varies across platforms.🧼Soapnot provided.Commonly used for various content concerning bathing, washing, cleaning, and water. Shower heads are also featured in🛁Bathtuband🛀Person Taking a Bath."
1188,🛁,Bathtub,U+1F6C1,"A white bathtub with a silvershowerhead. Often depicted as a cast-iron tub with claw-foot legs. Commonly used for various content concerning bathing, washing, cleaning, and bathrooms more generally.Several platforms, including Apple and Facebook, featuresoapbubbles or suds. Samsung’s design displays streaming water from the shower head.Vendors implement🛀Person Taking a Bathwith the same or a similar emoji, but with a person soaking in the tub."
1189,🪒,Razor,U+1FA92,"A razor which may be displayed as a razor blade or a safety razor.Razorwas approved as part ofUnicode 12.0in 2019
and added toEmoji 12.0in 2019."
1190,🧴,Lotion Bottle,U+1F9F4,"A bottle of lotion for the skin, such as moisturizer or sunscreen (sunblock). May be used for other hygienic liquids, including shampoo andbody wash, as well as beauty products.Appearance varies across platforms, but commonly depicted in white and gold colors. Some platforms, like Apple and Twitter, feature a bottle with a pump while others show a cylinder with a cap."
1191,🧷,Safety Pin,U+1F9F7,"A silver safety pin or clip, as used to fasten fabric. Generally shown clasped at a 45° angle, with its spring at the lower left.May be used for various content concerning arts, crafts, and sewing. Not to be confused with📎Paperclip."
1192,🧹,Broom,U+1F9F9,"A traditional broom, as used for sweeping—or ridden by awitch. Shown at a 45° angle, with a wooden handle and yellow bristles at the lower left.Commonly used for various content concerning cleaning, brushing, and figurativesweeps(e.g., in sports or awards). Not to be confused with🖌️Paintbrush."
1193,🧺,Basket,U+1F9FA,"A basket, as used for storing or carrying such things as food or clothes. Appearance widely varies across platforms but generally depicted as woven from wicker with one or more handles. Commonly used to represent doing laundry or having a picnic.Microsoft’s design suggests a laundry basket holding a blue garment or cloth. Apple and WhatsApp’s designs, featuring a white cloth, suggest abreador picnic basket. Samsung’s design displays green fabric, as knitted fromyarn.Not to be confused with🗑️Wastebasket."
1194,🧻,Roll of Paper,U+1F9FB,"A roll of paper, as toilet paper (toilet tissue). May also be a roll of kitchen/paper towels. Depicted at various angles, with a sheet unfurling.Commonly used for toilet paper but may also be used for various content concerningtoilets, going to the bathroom, bathrooms, cleaning, or paper more generally."
1195,🧼,Soap,U+1F9FC,"A bar of soap, as used in theshower,bathor for hand washing.Generally shown with lathered bubbles. Depicted in various colors, often pink, and at different angles.Commonly used for various content concerning bathing, washing, and cleaning.May be used to represent the opposite of dirt or being dirty.Recommended for use toprevent the spread of COVID-19."
1196,🧽,Sponge,U+1F9FD,"Apeanut-shaped sponge, as used for cleaning or bathing. Generally depicted in yellow and at different angles across platforms. Commonly used for various content concerning bathing, washing, and cleaning."
1197,🧯,Fire Extinguisher,U+1F9EF,"A fire extinguisher, as used to put out smallfires. Depicted as a red tank with a black hose and pressure gauge. Most platforms include an image of a flame on a white label.Commonly used for various content concerning fire safety, emergencies, and literal and figurative fires."
1198,🛒,Shopping Cart,U+1F6D2,Shopping Cart
1199,🚬,Cigarette,U+1F6AC,"A lit, filtered cigarette, shown burning at differentdirections. Commonly used to represent variousforms of smoking (e.g., tobacco, marijuana, vaping) as well as metaphorical senses of smoking.Originally intended as a sign for a designated smoking area, as contrasted to🚭No Smoking Symbol. This isillustrated in Samsung’sprevious designof a stylized, white cigarette on a blue background."
1200,⚰️,️ Coffin,"U+26B0, U+FE0F","A traditional coffin, as used to bury the dead. Depicted at various angles as a closed, six-sided, wooden coffin, tapered at the head and foot with golden handles.Commonly used for various content concerning literal and figurative death. May also be used for various content concerning funerals, horror, andHalloween.Apple and Microsoft’s designs place flowers on their lids."
1201,⚱️,️ Funeral Urn,"U+26B1, U+FE0F","An urn, as used to hold thecrematedashes of the dead. Appearance varies, but generally depicted as a covered, bronze container with a rounded body and tapered foot.May be used for various content concerning death and funerals. May also be used for other types of vessels, such as pots or vases.Not to be confused with🏺Amphora."
1202,🗿,Moai,U+1F5FF,"Amoai, one of the famed, giant stone statues of human figureson Easter Island. Depicted as a graystone carving of a stylized human head with a prominent brow and nose, most often facing left.Sometimes used for various idiosyncratic purposes, such as conveying a stoic, deadpan, or silly expression.Its official Unicode name ofMoyaiand inclusion in early Japanese emoji sets, such as from au by KDDI, suggestthe emoji may represent theMoyai Statuenear Shibuya Station in Tokyo, Japan; previous designs fromGoogleandMicrosoftresemble the Tokyo statue. Other Tokyo landmarks are represented in🗼Tokyo Towerand, formerly,Shibuya 109."
1203,🚰,Potable Water,U+1F6B0,"A symbol for potable (drinkable) water, usually shown with a faucet filling a drinking glass. Commonly used for various content concerning water, drinking, thirst, and dripping.Some platforms, including Apple and WhatsApp, depict the emoji as an object while others feature a stylized, white faucet on a blue square, as a sign or icon of water that is safe to drink. Compare🚱 Non-Potable Water, which indicates water that is not safe to drink.Apple's designpreviously featureda blue symbol design,Microsoft'sa cup filled with water."
1204,💘,Heart with Arrow,U+1F498,"A heart emoji with an arrow through the center, like the arrow that cupid shoots for love."
1205,💝,Heart with Ribbon,U+1F49D,"A heart-shaped box, tied with aribbon. May be a gift box, box of chocolates, or a jewellery box."
1206,💖,Sparkling Heart,U+1F496,"A pink love heart with stars around it, making it look like it is sparkling or shimmering."
1207,💗,Growing Heart,U+1F497,"A pink heart, inside a slightly larger pink heart, inside a larger-again pink heart. Intended to give the impression of a heart increasing in size."
1208,💓,Beating Heart,U+1F493,"A heart with vibration / movement lines above it, indicating it is a beating heart. Displayed in pink or red on most platforms, this emoji is intended to be used as abeating heart representingeither life, or love."
1209,💞,Revolving Hearts,U+1F49E,"Hearts revolving around one or more other hearts. This emoji was originally animated on a number of Japanese devices.Apple’s artwork for this emoji showstwo hearts switching places, with a circular line simulatingtheaction this would make.Google’s artwork previously displayedfive hearts in a circle-like shape."
1210,💕,Two Hearts,U+1F495,"Two pink love hearts. One larger than the other. Can be used to display that “love is in the air”.OnSnapchat, this emoji next to a contact denotes that you have been #1 BFs with each other for two consecutive months.A bug in October 2019 has ayellow heart emoji showing instead of💕 for some Snapchat users."
1211,💟,Heart Decoration,U+1F49F,A decorative heart that displays on Apple devices as a white heart-shaped cutout in a pink or purple roundrect.
1212,❣️,️ Heart Exclamation,"U+2763, U+FE0F","A decorativeexclamation mark, where a heart forms the top part of the symbol, and a circle the lower part. Similar to the way to theman in business suit levitatingalso creates a similar shape."
1213,💔,Broken Heart,U+1F494,"A loveheart, broken in two. This emoji represents the aching one feels when they are missing the person they love."
1214,❤️,️ Red Heart,"U+2764, U+FE0F","A classic love heart emoji, used for expressions of love. Displayed in various shades of red on most platforms. A similaremoji existsfor theheart suitin a deck of playing cards.OnSnapchat, this emoji displays next to a friendwhen you have been #1 BFs with each other for two consecutive weeks.Note: the Unicode character name “Heavy Black Heart”pre-dates color emoji, when the term referred to a solid, black ❤︎ heart character. See the glossary for information on the termblackin Unicode character names."
1215,🧡,Orange Heart,U+1F9E1,Orange Heart
1216,💛,Yellow Heart,U+1F49B,"A yellow or gold colored love-heart.Inexplicably, this displayed as a pinkhairy hearton Android 4.4.OnSnapchat,thisemoji next to a contactdenotes a person that you snap the most, and who also snaps you the most (#1 best friend). The yellow#1 BF heartturns into ared heartafter two weeks.A bug in October 2019 has thisyellow heart emoji showing instead of💕 for some Snapchat users."
1217,💚,Green Heart,U+1F49A,A green heart emoji.The Android 4.4 artwork for this emoji appeared to show beads of sweat on an orange and pink heart.
1218,💙,Blue Heart,U+1F499,A blue heart emoji.
1219,💜,Purple Heart,U+1F49C,A purple heart emoji. Shown as pink in Android 4.4.
1220,🤎,Brown Heart,U+1F90E,"Brown Heartwas approved as part ofUnicode 12.0in 2019
and added toEmoji 12.0in 2019."
1221,🖤,Black Heart,U+1F5A4,"A heart shaded completely black. May be used to express morbidity, sorrow, or a form of dark humor.Not to be confused with theHeavy Black HeartorBlack Heart Suitwhich are bothred."
1222,🤍,White Heart,U+1F90D,"A white heart emoji to accompany other hearts such as ❤️🧡💛💚💙💜🖤 approved as part ofEmoji 12.0in 2019, and now available on major platforms.A character known asWhite Heart Suitis sometimes used in its place, but this is not intended to have an emoji appearance.White Heartwas approved as part ofUnicode 12.0in 2019
and added toEmoji 12.0in 2019."
1223,💯,Hundred Points,U+1F4AF,"100 emoji: the number one-hundred, written in red, underlined twice for emphasis.Originating from the number100written on a school exam or paperto indicate a perfect scoreof 100 out of 100. Teachers in Japan mayalsouse astampin addition to the 100 mark, to indicatethat a student has performed very well.This 100emojiis commonly used as a shorthand for100%, with the usage meaning “keep it real” or a similar sentiment. A 100 emoji can be used to express pride or general acceptance of an idea.InSnapchat, the 100 emoji appearing next to afire emojiindicates a 100 day Snapstreak."
1224,💢,Anger Symbol,U+1F4A2,"A red symbol found in Anime/Manga andusedto represent theveins poppingon a very angry person.Alsoused in othercomic books to indicate a punch landed, perhaps next to the words “Bam” or “Pow”."
1225,💬,Speech Balloon,U+1F4AC,A cartoon-style balloon used to represent spoken word in comics. Sometimes used in communication apps toindicate that another person is typing a message.
1226,👁️‍🗨️,️‍🗨️ Eye in Speech Bubble,"U+1F441, U+FE0F, U+200D, U+1F5E8, U+FE0F","A speech bubble showing an eye inside. When using text-to-speech on Apple platforms, this emoji is read aloud as: ""Eye in speech bubble representing anti-bullying campaign"". This emoji was released in conjunction with the Ad Council for theI Am A Witnesscampaign.The Eye in Speech Bubble emoji is aZWJ sequencecombining👁Eye,‍Zero Width Joinerand🗨Left Speech Bubble.
These display as a single emoji on supported platforms."
1227,🗨️,️ Left Speech Bubble,"U+1F5E8, U+FE0F","A left-facing speech bubble, which was included in Unicode 7.0, but not considered astandard additionfor the purposes of emoji presentation."
1228,🗯️,️ Right Anger Bubble,"U+1F5EF, U+FE0F","A form ofspeech balloonused with angular edges, used to denote angry speech in comics."
1229,💭,Thought Balloon,U+1F4AD,"A large cloud-like shape more commonly known as a thought bubble.Used to represent thinking, or thoughts, and commonly used incomics to display the thoughts of a drawn character. May also be used to represent a dream, or daydream."
1230,💤,Zzz,U+1F4A4,"A series of three Zs making a Zzz. Represents sleeping, snoring, dreaming, or any sleep-related state. Can also be used in some contexts to represent something that isboring."
1231,💮,White Flower,U+1F4AE,"A stylized white flower. Generally depicted as arosette-shapedcherry blossomin pink or red outline, often with a white fill.Apple, WhatsApp, and Facebook's designs feature Japanese characters roughly translating tovery well done, used by teachers as a stamp for students who did exceptional work, often accompanied by ascore in red.Commonly used forValentine’s Day,Mother’s Day, and other special occasions. May be more generally used to express such ideas as love, happiness, and beauty.Also used as a pink, white, or redaccent color.Not to be confused with🌸 Cherry Blossomand🌺 Hibiscus, though their applications may overlap.Apple's flowerpreviouslyfeatured a red-outlined design,Google'san orange outline.Microsoft'sflower was previously black and white,SamsungandFacebook'spink and white."
1232,♨️,️ Hot Springs,"U+2668, U+FE0F",Representation ofhot springs with steam risingfrom a circular tub. This is the common symbol used to represent anonsenonmaps inJapan.
1233,💈,Barber Pole,U+1F488,"A pole spiraled with red, white, and blue stripes, as spins out front of abarbershop. Commonly used for various content concerning haircutting and hairstyling.May also be associated withbrothelsin parts of Asia."
1234,🛑,Stop Sign,U+1F6D1,"A red, octagonal sign. Used in many countries as a stop sign."
1235,🕛,Twelve O’Clock,U+1F55B,Twelve O’Clock
1236,🕧,Twelve-Thirty,U+1F567,Twelve-Thirty
1237,🕐,One O’Clock,U+1F550,One O’Clock
1238,🕜,One-Thirty,U+1F55C,One-Thirty
1239,🕑,Two O’Clock,U+1F551,Two O’Clock
1240,🕝,Two-Thirty,U+1F55D,Two-Thirty
1241,🕒,Three O’Clock,U+1F552,Three O’Clock
1242,🕞,Three-Thirty,U+1F55E,Three-Thirty
1243,🕓,Four O’Clock,U+1F553,Four O’Clock
1244,🕟,Four-Thirty,U+1F55F,Four-Thirty
1245,🕔,Five O’Clock,U+1F554,Five O’Clock
1246,🕠,Five-Thirty,U+1F560,Five-Thirty
1247,🕕,Six O’Clock,U+1F555,Six O’Clock
1248,🕡,Six-Thirty,U+1F561,Six-Thirty
1249,🕖,Seven O’Clock,U+1F556,Seven O’Clock
1250,🕢,Seven-Thirty,U+1F562,Seven-Thirty
1251,🕗,Eight O’Clock,U+1F557,Eight O’Clock
1252,🕣,Eight-Thirty,U+1F563,Eight-Thirty
1253,🕘,Nine O’Clock,U+1F558,Nine O’Clock
1254,🕤,Nine-Thirty,U+1F564,Nine-Thirty
1255,🕙,Ten O’Clock,U+1F559,Ten O’Clock
1256,🕥,Ten-Thirty,U+1F565,Ten-Thirty
1257,🕚,Eleven O’Clock,U+1F55A,Eleven O’Clock
1258,🕦,Eleven-Thirty,U+1F566,Eleven-Thirty
1259,🌀,Cyclone,U+1F300,"An icon used torepresent acyclone.Some versions of this emojishowaspiral shape, which may be used for decorative purposes."
1260,♠️,️ Spade Suit,"U+2660, U+FE0F","A spade symbol emoji, which is used in card gamesfor thespadessuit.See the glossary for information on the termblackin unicode character names."
1261,♥️,️ Heart Suit,"U+2665, U+FE0F","A heart symbol emoji, which is used in card gamesfor theheartssuit. Generally shown in red, despite the name. Not to be confused with theblack heart emoji.See the glossary for information on the termblackin unicode character names."
1262,♦️,️ Diamond Suit,"U+2666, U+FE0F","A diamond symbol emoji, which is used in card games for thediamondssuit.See the glossary for information on the termblackin unicode character names."
1263,♣️,️ Club Suit,"U+2663, U+FE0F","A club symbol emoji, which is used in card games for theclubssuit."
1264,🃏,Joker,U+1F0CF,"The joker in a deck of cards, usually appearinglike acourt jester."
1265,🀄,Mahjong Red Dragon,U+1F004,"The red dragon tile in the game ofJapanese Mahjong. White, withred中 character printed on it."
1266,🎴,Flower Playing Cards,U+1F3B4,"A type of cards known ashanafuda cardsin Japan which are used fora range of different games that require associating pictures(there are no numbers on the cards).The artwork for this emojishows theFull Moon with Red Skycard, but could theoretically displayany of the available cards."
1267,🔇,Muted Speaker,U+1F507,"A speaker with a red line through it, indicating muted volume or silencingof audio."
1268,🔈,Speaker Low Volume,U+1F508,A speaker cone displayed without any soundwaves.
1269,🔉,Speaker Medium Volume,U+1F509,"A speaker cone displayed with one soundwave, generally used as an icon to indicate the decreasingof volume on a phone or computer.Previously displayedwith two sound waves on Android, instead of one."
1270,🔊,Speaker High Volume,U+1F50A,"A speaker cone displayed with three sound waves, generally used as an icon to indicate the increasing of volume on a phone or computer."
1271,📢,Loudspeaker,U+1F4E2,"A loudspeaker used to make announcements in public areas such as schools, or sporting grounds."
1272,📣,Megaphone,U+1F4E3,Megaphone
